/ 7	. 

/ (69)

/ we hadden eerder	,
create table source(
nr integer not null unique,
a integer not null,
b integer not null,
primary key(a,b));

/ we willen column nr rm	,
eric=> alter table source drop nr;      
ALTER TABLE

-- deze hebben we gedaan	,
insert into source
values(1,1),(1,2), -- a=1
(2,3),(2,4),			-- a=2
(5,5),(5,1),(5,3),
(7,2),
(9,0),
(11,2);
-- deze hebben we niet gedaan	,
insert into source
values(9,0), 	-- b=0
(1,1),(5,1),	-- b=1
(1,2),(7,2),(11,2),
(2,3),(5,3),
(2,4),
(5,5);

/ 131313	. 

/ a asc, b desc
/ dit geeft 4 rijen met unique a,b	,

with x(a,b,nr)
as(
select a,b,row_number()over(order by a asc,b desc)
from source
)
select * from x;
 a  | b | nr 
----+---+----
  1 | 2 |  1
  1 | 1 |  2
  2 | 4 |  3
  2 | 3 |  4
  5 | 5 |  5
  5 | 3 |  6
  5 | 1 |  7
  7 | 2 |  8
  9 | 0 |  9
 11 | 2 | 10
(10 rows)
-- geen partition, dus de row numbers gaan over de hele table	,


with x(a,b,nr)
as(
select a,b,row_number()over(order by a asc,b desc)
from source
)
select a,b,nr
from x p1
where not exists(
select *
from x p2
where p2.nr<p1.nr
and(p1.a=p2.a or p1.b=p2.b)
);
-- er is geen vorige rij dan de huidige rij die a of b gelijk heeft	,
 a | b | nr 
---+---+----
 1 | 2 |  1
 2 | 4 |  3
 5 | 5 |  5
 9 | 0 |  9
(4 rows)
-- a en b zijn beide unique	,

/ 131313	. 

/ a asc,b asc
/ nu hebben we maar 3 rijen met unique a,b

with x(a,b,nr)
as(
select a,b,row_number()over(order by a asc,b asc)
from source
)
select * from x;
 a  | b | nr 
----+---+----
  1 | 1 |  1
  1 | 2 |  2
  2 | 3 |  3
  2 | 4 |  4
  5 | 1 |  5
  5 | 3 |  6
  5 | 5 |  7
  7 | 2 |  8
  9 | 0 |  9
 11 | 2 | 10
(10 rows)

with x(a,b,nr)
as(
select a,b,row_number()over(order by a asc,b asc)
from source
)
select a,b,nr
from x p1
where not exists(
select *
from x p2
where p2.nr<p1.nr
and(p1.a=p2.a or p1.b=p2.b)
);
-- er is geen vorige rij dan de huidige rij die a of b gelijk heeft	,
 a | b | nr 
---+---+----
 1 | 1 |  1
 2 | 3 |  3
 9 | 0 |  9
(3 rows)
-- a en b zijn beide unique	,
/ 5,5 zit er ten onrechte niet bij	,
/ de query kijkt naar de bovenliggende rijen uit de table x, maar niet naar de gekozen entries, en dat zou moeten	,



/ 7	. 

/ (70)

/ 1313	. 

create table source(
nr integer not null unique,
a integer not null,
b integer not null,
primary key(a,b));

insert into source 
values(1,1,1),(2,1,2),(3,2,3),(4,7,2),(5,2,4),(6,5,5),(7,5,1),(8,5,3),(9,9,0),(10,11,2);

/ 13	. 

with flags(i)as(
select *
from (values('t'),('f'))_
)
select i
from flags;
 i 
---
 t
 f
(2 rows)

/ of	,

with flags as(
select *
from (values('t'),('f'))_(i)
)
select i
from flags;
 i 
---
 t
 f
(2 rows)



/ 1313	,

with flags(i)as(
select*
from (values('t'),('f'))t
),
subsets(nr,f01,f02,f03,f04)as( -- name columns  ,
select row_number()over()nr,f01.i,f02.i,f03.i,f04.i
from flags f01
cross join flags f02
cross join flags f03
cross join flags f04
)
select *
from subsets
;
 nr | f01 | f02 | f03 | f04 
----+-----+-----+-----+-----
  1 | t   | t   | t   | t
  2 | t   | f   | t   | t
  3 | f   | t   | t   | t
  4 | f   | f   | t   | t
  5 | t   | t   | f   | t
  6 | t   | f   | f   | t
  7 | f   | t   | f   | t
  8 | f   | f   | f   | t
  9 | t   | t   | t   | f
 10 | t   | f   | t   | f
 11 | f   | t   | t   | f
 12 | f   | f   | t   | f
 13 | t   | t   | f   | f
 14 | t   | f   | f   | f
 15 | f   | t   | f   | f
 16 | f   | f   | f   | f
(16 rows)
/ we hadden f02 en f01 verwisseld verwacht,	

/ 1313	. 

with flags(i)as(
select*
from (values('t'),('f'))t
),
subsets(nr,f01,f02,f03)as( -- name columns  ,
select row_number()over()nr,f01.i,f02.i,f03.i
from flags f01
cross join flags f02
cross join flags f03
)
select *
from subsets;
/ of	,
with flags(i)as(
select*
from (values('t'),('f'))t
),
subsets(nr,f01,f02,f03)as( -- name columns  ,
select row_number()over()nr,f01.i,f02.i,f03.i
from flags f01
,flags f02
,flags f03
)
select *
from subsets;
 nr | f01 | f02 | f03 
----+-----+-----+-----
  1 | t   | t   | t
  2 | t   | f   | t
  3 | f   | t   | t
  4 | f   | f   | t
  5 | t   | t   | f
  6 | t   | f   | f
  7 | f   | t   | f
  8 | f   | f   | f
(8 rows)
/ we hadden f02 en f01 verwisseld verwacht,	

-- subsets en source zijn oo van elkaar	,
-- de columns van subsets zijn oo van elkaar	,
-- pak van source de 1ste, en cross join met die subsets die f01='t' hebben	,
-- pak van source de 2de, en cross join met die subsets die f02='t' hebben	,
...
with flags(i)as(
select*
from (values('t'),('f'))t
),
subsets(nr,f01,f02,f03)as( -- name columns  ,
select row_number()over()nr,f01.i,f02.i,f03.i
from flags f01
cross join flags f02
cross join flags f03
),
candidates(nr,a,b)
as(
select p.nr,s.a,s.b
from subsets p,source s
where s.nr=1 and p.f01='t' 
union all
select p.nr,s.a,s.b
from subsets p,source s
where s.nr=2 and p.f02='t' 
union all
select p.nr,s.a,s.b
from subsets p,source s
where s.nr=3 and p.f03='t' 
)
select nr,a,b
from candidates c1
;
 nr | a | b 
----+---+---
  1 | 1 | 1
  2 | 1 | 1
  5 | 1 | 1
  6 | 1 | 1
  1 | 1 | 2
  3 | 1 | 2
  5 | 1 | 2
  7 | 1 | 2
  1 | 2 | 3
  2 | 2 | 3
  3 | 2 | 3
  4 | 2 | 3
(12 rows)

/ 1313	. 

with flags(i)as(
select*
from (values('t'),('f'))t
),
subsets(nr,f01,f02,f03)as( -- name columns  ,
select row_number()over()nr,f01.i,f02.i,f03.i
from flags f01
cross join flags f02
cross join flags f03
),
candidates(nr,a,b)
as(
select p.nr,s.a,s.b
from subsets p,source s
where s.nr=1 and p.f01='t' 
union all
select p.nr,s.a,s.b
from subsets p,source s
where s.nr=2 and p.f02='t' 
union all
select p.nr,s.a,s.b
from subsets p,source s
where s.nr=3 and p.f03='t' 
)
select nr			-- dezen nr hebben unieke a's en unieke b's
from candidates
group by nr
having count(a)=count(distinct a)
and count(b)=count(distinct b)
;
 nr 
----
  2
  3
  4
  6
  7
(5 rows)


with flags(i)as(
select*
from (values('t'),('f'))t
),
subsets(nr,f01,f02,f03)as( -- name columns  ,
select row_number()over()nr,f01.i,f02.i,f03.i
from flags f01
cross join flags f02
cross join flags f03
),
candidates(nr,a,b)
as(
select p.nr,s.a,s.b
from subsets p,source s
where s.nr=1 and p.f01='t' 
union all
select p.nr,s.a,s.b
from subsets p,source s
where s.nr=2 and p.f02='t' 
union all
select p.nr,s.a,s.b
from subsets p,source s
where s.nr=3 and p.f03='t' 
)
select nr,a,b
from candidates c1
where nr in(
select c2.nr
from candidates c2
group by c2.nr
having count(a)=count(distinct a)
and count(b)=count(distinct b)
)
order by nr,a,b;
 nr | a | b 
----+---+---
  2 | 1 | 1
  2 | 2 | 3
  3 | 1 | 2
  3 | 2 | 3
  4 | 2 | 3
  6 | 1 | 1
  7 | 1 | 2
(7 rows)

/ 1313	. 

with flags(i)as(
select*
from (values('t'),('f'))t
),
subsets(nr,f01,f02,f03,f04,f05,f06,f07,f08,f09,f10)as( -- name columns  ,
select row_number()over()nr,f01.i,f02.i,f03.i,f04.i,f05.i,f06.i,f07.i,f08.i,f09.i,f10.i
from flags f01
cross join flags f02
cross join flags f03
cross join flags f04
cross join flags f05
cross join flags f06
cross join flags f07
cross join flags f08
cross join flags f09
cross join flags f10
)
select *
from subsets
;
  nr  | f01 | f02 | f03 | f04 | f05 | f06 | f07 | f08 | f09 | f10
------+-----+-----+-----+-----+-----+-----+-----+-----+-----+-----
    1 | t   | t   | t   | t   | t   | t   | t   | t   | t   | t
    2 | t   | t   | t   | t   | t   | t   | t   | t   | t   | f
    3 | t   | t   | t   | t   | t   | t   | t   | t   | f   | t
    4 | t   | t   | t   | t   | t   | t   | t   | t   | f   | f
    5 | t   | f   | t   | t   | t   | t   | t   | t   | t   | t
    6 | t   | f   | t   | t   | t   | t   | t   | t   | t   | f
...
-- hij kiest de volgorde vreemd ,
 1021 | f   | f   | f   | f   | f   | f   | f   | f   | t   | t
 1022 | f   | f   | f   | f   | f   | f   | f   | f   | t   | f
 1023 | f   | f   | f   | f   | f   | f   | f   | f   | f   | t
 1024 | f   | f   | f   | f   | f   | f   | f   | f   | f   | f
(1024 rows)

/ 1313	,

with flags(i)as(
select*
from (values('t'),('f'))t
),
subsets(nr,f01,f02,f03,f04,f05,f06,f07,f08,f09,f10)as( -- name columns  ,
select row_number()over()nr,f01.i,f02.i,f03.i,f04.i,f05.i,f06.i,f07.i,f08.i,f09.i,f10.i
from flags f01
cross join flags f02
cross join flags f03
cross join flags f04
cross join flags f05
cross join flags f06
cross join flags f07
cross join flags f08
cross join flags f09
cross join flags f10
),
candidates(nr,a,b)
as(
select p.nr,s.a,s.b
from subsets p,source s
where s.nr=1 and p.f01='t' 
union all
select p.nr,s.a,s.b
from subsets p,source s
where s.nr=2 and p.f02='t' 
union all
select p.nr,s.a,s.b
from subsets p,source s
where s.nr=3 and p.f03='t' 
union all
select p.nr,s.a,s.b
from subsets p,source s
where s.nr=4 and p.f04='t' 
union all
select p.nr,s.a,s.b
from subsets p,source s
where s.nr=5 and p.f05='t' 
union all
select p.nr,s.a,s.b
from subsets p,source s
where s.nr=6 and p.f06='t' 
union all
select p.nr,s.a,s.b
from subsets p,source s
where s.nr=7 and p.f07='t' 
union all
select p.nr,s.a,s.b
from subsets p,source s
where s.nr=8 and p.f08='t' 
union all
select p.nr,s.a,s.b
from subsets p,source s
where s.nr=9 and p.f09='t' 
union all
select p.nr,s.a,s.b
from subsets p,source s
where s.nr=10 and p.f10='t' 
)
select nr,a,b
into res
from candidates c1
;

select a,b,count(*) 
from res
group by a,b
;
 a  | b | count 
----+---+-------
  5 | 5 |   512
  2 | 4 |   512
  7 | 2 |   512
  1 | 1 |   512
  9 | 0 |   512
 11 | 2 |   512
  5 | 3 |   512
  1 | 2 |   512
  2 | 3 |   512
  5 | 1 |   512
(10 rows)
/ klopt, er zijn in een column de helft 't' 	, dus altijd 512	,
/ we zien alle paren van source	,

eric=> select*from res;
  nr  | a  | b 
------+----+---
    1 |  1 | 1
    2 |  1 | 1
    3 |  1 | 1
    4 |  1 | 1
    5 |  1 | 1
    6 |  1 | 1
    7 |  1 | 1
    8 |  1 | 1
   17 |  1 | 1
   18 |  1 | 1
   19 |  1 | 1
   20 |  1 | 1
   21 |  1 | 1
   22 |  1 | 1
   23 |  1 | 1
   24 |  1 | 1
   33 |  1 | 1
   34 |  1 | 1
   35 |  1 | 1
...
 1012 |  1 | 1
 1013 |  1 | 1
 1014 |  1 | 1
 1015 |  1 | 1
 1016 |  1 | 1
    1 |  1 | 2
    2 |  1 | 2
    3 |  1 | 2
    4 |  1 | 2
    9 |  1 | 2
   10 |  1 | 2
   11 |  1 | 2
...


/ 1313	. 

with flags(i)as(
select*
from (values('t'),('f'))t
),
subsets(nr,f01,f02,f03,f04,f05,f06,f07,f08,f09,f10)as( -- name columns  ,
select row_number()over()nr,f01.i,f02.i,f03.i,f04.i,f05.i,f06.i,f07.i,f08.i,f09.i,f10.i
from flags f01
cross join flags f02
cross join flags f03
cross join flags f04
cross join flags f05
cross join flags f06
cross join flags f07
cross join flags f08
cross join flags f09
cross join flags f10
),
candidates(nr,a,b)
as(
select p.nr,s.a,s.b
from subsets p,source s
where s.nr=1 and p.f01='t' 
union all
select p.nr,s.a,s.b
from subsets p,source s
where s.nr=2 and p.f02='t' 
union all
select p.nr,s.a,s.b
from subsets p,source s
where s.nr=3 and p.f03='t' 
union all
select p.nr,s.a,s.b
from subsets p,source s
where s.nr=4 and p.f04='t' 
union all
select p.nr,s.a,s.b
from subsets p,source s
where s.nr=5 and p.f05='t' 
union all
select p.nr,s.a,s.b
from subsets p,source s
where s.nr=6 and p.f06='t' 
union all
select p.nr,s.a,s.b
from subsets p,source s
where s.nr=7 and p.f07='t' 
union all
select p.nr,s.a,s.b
from subsets p,source s
where s.nr=8 and p.f08='t' 
union all
select p.nr,s.a,s.b
from subsets p,source s
where s.nr=9 and p.f09='t' 
union all
select p.nr,s.a,s.b
from subsets p,source s
where s.nr=10 and p.f10='t' 
)
select nr,a,b
from candidates c1
where nr in(
select c2.nr
from candidates c2
group by c2.nr
having count(a)=count(distinct a)
and count(b)=count(distinct b)
and count(*)>5)
order by nr,a,b;



/ 13	. 

eric=> values('t'),('f');
 column1 
---------
 t
 f
(2 rows)

/ 13	 .

/ we kunnen column1 niet rename	, 
/ TODO

/ 13	. 

eric=> select 't'a,'f'b;
 a  | b 
----+----
 t  | f
(1 row)

/ net zo iets	,
eric=> select (values('t'),('f'))_;
ERROR:  more than one row returned by a subquery used as an expression

/ 13	. 

eric=> select * from (values('t'),('f'))_(i);
 i 
---
 t
 f
(2 rows)

/ maar	,

eric=> (values('t'),('f'))_(i);
ERROR:  syntax error at or near "_"

eric=> select from (values('t'),('f'))_(i);
--
(2 rows)


/ 7	. 

/ google	,
postgres sub query brackets
/ lees	,
https://stackoverflow.com/questions/46538515/postgres-wraps-subquery-results-in-parentheses

eric=> select e from (values(7),(13))e;
  e   
------
 (7)
 (13)
(2 rows)
/ je select rijen	,

/ 7	. 

/ google	,
ERROR:  more than one row returned by a subquery used as an expression
/ lees	,
https://stackoverflow.com/questions/21048955/postgres-error-more-than-one-row-returned-by-a-subquery-used-as-an-expression

UPDATE customer
SET customer_id=(
	SELECT t1 
	FROM dblink('port=5432, dbname=SERVER1 user=postgres password=309245',
   'SELECT store_key FROM store') AS (t1 integer));

/ we kunnen zoiets niet	,
select i from (values('t'),('f'))(i int);
/ ERR	,

This error means that the SELECT store_key FROM store query has returned two or more rows in the SERVER1 database. If you would like to update all customers, use a join instead of a scalar = operator. You need a condition to "connect" customers to store items in order to do that.

If you wish to update all customer_ids to the same store_key, you need to supply a WHERE clause to the remotely executed SELECT so that the query returns a single row.

/ 7	. 

select * 
from (values(7),(13))s(i)
natural join (values(7),(6))t(i) 
;
 i 
---
 7
(1 row)

select * 
from (values(7),(13))s(i)
cross join (values(7),(6))t(i) 
;
 i  | i 
----+---
  7 | 7
  7 | 6
 13 | 7
 13 | 6
(4 rows)

select * 
from (values(7),(13))s(i)
order by i
cross join (values(7),(6))t(i) 
;

/ 7	. 

/ order a join	,

eric=> select * 
from (values(7),(13))s(i)
cross join (values(7),(6))t(j)
order by i; 
 i  | j 
----+---
  7 | 7
  7 | 6
 13 | 7
 13 | 6
(4 rows)


select * 
from (values(7),(13))s(i)
cross join (values(7),(6))t(j) 
order by j 
;
 i  | j 
----+---
  7 | 6
 13 | 6
  7 | 7
 13 | 7
(4 rows)

eric=> select * 
eric-> from (values(7),(13))s(i)
eric-> cross join (values(7),(6))t(j)
eric-> order by i,j
eric-> ;
 i  | j 
----+---
  7 | 6
  7 | 7
 13 | 6
 13 | 7
(4 rows)

select * 
from (values(7),(13))s(i)
cross join (values(7),(6))t(j) 
order by j 
;

select *
from (values(7),(13))s(i)
--order by i 
union all
select *
from (values(6),(12))t(j)
order by j;

ERROR:  column "j" does not exist
LINE 7: order by j;
HINT:  There is a column named "j" in table "*SELECT* 2", but it cannot be referenced from this part of the query.

